{
  "schema_version": "0.1.0",
  "question_id": "q-audit-001",
  "created_at": "2026-10-14T01:07:00Z",

  "question_origin": "audit",
  "question_type": "verification",

  "intent": "verify_execution_authority",

  "domain": [
    "authorization",
    "safety"
  ],

  "context": {
    "summary": "Verify whether the proposed action has valid execution authority."
  },

  "risk_level": "high",

  "authority": {
    "required": false
  },

  "status": "routed",

  "parent_question_id": "q-parent-002",
  "derived_from": "q-parent-002",

  "assigned_to": "authority-auditor",
  "trace_parent": "trace-q-parent-002"
}
