{
  "schema_version": "0.1.0",
  "question_id": "q-recovery-001",
  "created_at": "2026-10-14T01:10:45Z",

  "question_origin": "recovery",
  "question_type": "recovery",

  "intent": "determine_safe_resume",

  "domain": [
    "recovery",
    "operations",
    "safety"
  ],

  "context": {
    "summary": "A previous operation was interrupted. Determine whether it can be safely resumed without reusing stale authority or assumptions."
  },

  "risk_level": "high",

  "authority": {
    "required": false
  },

  "status": "routed",

  "parent_question_id": "q-interrupted-operation-001",
  "derived_from": "q-interrupted-operation-001",

  "assigned_to": "recovery-analysis-agent",
  "trace_parent": "trace-interrupted-operation-001"
}
