{
  "schema_version": "0.1.0",
  "question_id": "q-basic-external-001",
  "created_at": "2026-10-14T01:05:00Z",

  "question_origin": "external",
  "question_type": "request",

  "intent": "summarize_document",

  "domain": [
    "document_processing"
  ],

  "risk_level": "low",

  "authority": {
    "required": false
  },

  "status": "created"
}
